{
  "suite": "visual",
  "case": "grid-french",
  "aggregate": 0.975,
  "pass": true,
  "criteria": [
    { "id": 1, "score": 1, "weight": 0.25, "blocker": true, "evidence": "Teal bar with 'Réalisations' + bare ⋮; 'Records personnels' strip with right-aligned '5 sur 6'; 'Courses virtuelles' strip; cells show badge + title + value throughout — the full FR payload rendered (ADR-0013)." },
    { "id": 2, "score": 1, "weight": 0.2, "blocker": true, "evidence": "No ellipsis anywhere: 'Course virtuelle de demi-marathon' wraps to two lines; 'Altitude la plus élevée' and all other titles fully visible." },
    { "id": 3, "score": 1, "weight": 0.15, "evidence": "Generic titles are French (Course la plus longue, 5 km le plus rapide, 10 km, Demi-marathon); brand races stay verbatim ('Tokyo-Hakone Ekiden 2020') exactly per the contract's brand rule." },
    { "id": 4, "score": 1, "weight": 0.15, "evidence": "Locked Marathon is ghosted with 'Pas encore'; earned values remain verbatim numerics (00:00, 00:00:00, 2095 ft) — numbers untranslated per ADR-0010." },
    { "id": 5, "score": 1, "weight": 0.1, "evidence": "Two-column grid, badge-over-title-over-value rhythm, header strips full-width — layout identical to the EN golden; only text differs (parity invariant)." },
    { "id": 6, "score": 1, "weight": 0.1, "evidence": "Token fidelity holds: teal #63C6D4 bar, light section strips, white surface, navy badges, grey ghost treatment." },
    { "id": 7, "score": 0.5, "weight": 0.05, "evidence": "White 16px 'Réalisations' on the mock teal ≈2.0:1 — the documented mock-fidelity exception (accessibility.md; high-contrast variant under Increased Contrast), scored consistently with every grid case." }
  ]
}
