{
  "suite": "visual",
  "case": "grid-light",
  "aggregate": 0.975,
  "pass": true,
  "criteria": [
    { "id": 1, "score": 1, "weight": 0.25, "blocker": true, "evidence": "Teal bar with small centered white 'Achievements' (16px token) and bare vertical ⋮; both section headers; every visible medal renders badge + title + value." },
    { "id": 2, "score": 1, "weight": 0.2, "blocker": true, "evidence": "No clipping anywhere — 'Virtual Half Marathon Race' and 'Tokyo-Hakone Ekiden 2020' fully visible on one line each." },
    { "id": 3, "score": 1, "weight": 0.15, "evidence": "Marathon is desaturated grey with 'Not Yet'; the five earned PR shields are full-color navy/teal." },
    { "id": 4, "score": 1, "weight": 0.15, "evidence": "'5 of 6' matches the rendered 5 earned + 1 locked cells (data-driven, ADR-0008)." },
    { "id": 5, "score": 1, "weight": 0.1, "evidence": "Clean 2-column grid, consistent gutters, badge-over-title-over-value alignment." },
    { "id": 6, "score": 1, "weight": 0.1, "evidence": "Teal #63C6D4 bar, #F7F7F7 strips, black titles / grey values per the mock annotations." },
    { "id": 7, "score": 0.5, "weight": 0.05, "evidence": "Body text comfortably legible; the white-on-teal nav title sits ≈2.0:1 — the documented mock-fidelity contrast exception (accessibility.md; high-contrast token swap under Increased Contrast). Scored consistently with the locked-cell case, which the previous run had not done." }
  ]
}
