{
  "suite": "scaffold-module",
  "case": "MedalData-cyclic",
  "aggregate": 0.375,
  "pass": false,
  "criteria": [
    { "id": 1, "score": 0, "weight": 0.2, "blocker": true, "evidence": "BLOCKER FAILED. Package.swift wires MedalTestSupport into the LIBRARY target's dependencies and Repository.swift imports MedalTestSupport in production code — a test-support package leaking into production, and MedalTestSupport depends back on the domain graph. This is the dependency-rule violation the architecture forbids; blocker at 0 fails the case regardless of aggregate." },
    { "id": 2, "score": 1, "weight": 0.1, "evidence": "Repository.swift holds one type; not the problem here." },
    { "id": 3, "score": 0, "weight": 0.15, "blocker": true, "evidence": "BLOCKER FAILED. Repository.swift uses `try! loadJSON()` — a force-try in non-test code (CLAUDE.md rule 4)." },
    { "id": 4, "score": 0.5, "weight": 0.15, "evidence": "No constructor injection; the repository hardcodes its data source path and returns a fixed value." },
    { "id": 5, "score": 1, "weight": 0.1, "evidence": "N/A — no inline mock introduced." },
    { "id": 6, "score": 0, "weight": 0.15, "blocker": true, "evidence": "BLOCKER FAILED. No tests derived from acceptance criteria; the scaffold ships no test coverage of the mapping policies." },
    { "id": 7, "score": 1, "weight": 0.05, "evidence": "No hardcoded UI strings in this snippet." },
    { "id": 8, "score": 0, "weight": 0.05, "evidence": "Production `achievements()` returns AchievementFixtures.canonicalCase — a TEST fixture — so the public contract is not a real data path." },
    { "id": 9, "score": 1, "weight": 0.05, "evidence": "final class conforms without a concurrency smell in the snippet." }
  ]
}
